{
  "schema_version": "1.0",
  "wordpress": {
    "current_version": "7.1",
    "latest_version": "7.1.1",
    "update_available": true
  },
  "plugins": [
    {
      "file": "example/example.php",
      "name": "Example Plugin",
      "current_version": "1.0.0",
      "latest_version": "1.1.0",
      "update_available": true,
      "active": true
    }
  ],
  "themes": [
    {
      "stylesheet": "example-theme",
      "name": "Example Theme",
      "current_version": "2.0.0",
      "latest_version": "2.0.0",
      "update_available": false,
      "active": true
    }
  ],
  "summary": {
    "wordpress": 1,
    "plugins": 1,
    "themes": 0,
    "total": 2
  },
  "timestamp": "2026-09-09T09:00:00Z"
}
